,Published,HDThumbnailUrl,ViewCount,VideoId,Title
0,2023-02-16T09:00:25Z,https://i.ytimg.com/vi/npGY6OoVICc/hqdefault.jpg,21526,npGY6OoVICc,토성에 가면 볼 수 있는 기이한 현상들 (실제 영상)
1,2023-02-14T09:00:28Z,https://i.ytimg.com/vi/j-mLaz-pVB8/hqdefault.jpg,76489,j-mLaz-pVB8,"""그 여자가 임신했습니다"".. 세계를 뒤흔든 중국의 유전자조작 인체실험"
2,2023-02-09T09:00:27Z,https://i.ytimg.com/vi/zNcPM0OtetI/hqdefault.jpg,40844,zNcPM0OtetI,절반이 텅 비어있다. 태양계에서 가장 미스터리한 소행성의 정체
3,2023-02-05T04:00:08Z,https://i.ytimg.com/vi/FwkluX-7cXM/hqdefault.jpg,64236,FwkluX-7cXM,구글도 페이스북도 실패했다. 당근마켓은 성공했다.
4,2023-02-02T09:00:30Z,https://i.ytimg.com/vi/WP8_tWGGP-k/hqdefault.jpg,129732,WP8_tWGGP-k,한국이 중국에게 졌다. 세계를 뒤흔들고 있는 중국 반도체의 비밀
5,2023-01-29T09:00:14Z,https://i.ytimg.com/vi/UWZNdrRtdfQ/hqdefault.jpg,140005,UWZNdrRtdfQ,"머스크: ""원전 폐쇄하는 나라 미친 나라, 아직도 환경단체에 속고 있음?"""
6,2023-01-23T09:00:33Z,https://i.ytimg.com/vi/qRMFrRO-bPg/hqdefault.jpg,217423,qRMFrRO-bPg,"사상 초유의 성과.. 하버드대 연구진, 나이를 되돌리는데 성공하다."
7,2023-01-22T09:00:03Z,https://i.ytimg.com/vi/6Jo-i17mFFA/hqdefault.jpg,65585,6Jo-i17mFFA,우주의 끝과 통신할 수 있는 유일한 방법
8,2023-01-19T09:00:03Z,https://i.ytimg.com/vi/4peo9sV1IZ0/hqdefault.jpg,60957,4peo9sV1IZ0,1년 시장 규모만 677조원.. 대통령도 투자한 어마어마한 시장 (클라우드)
9,2023-01-15T09:00:00Z,https://i.ytimg.com/vi/0eLhC6Bz9a8/hqdefault.jpg,291200,0eLhC6Bz9a8,"이거 국뽕인가? 유럽의 희망이 된 한국, 하얀 석유의 시대 (ft 테슬라)"
10,2023-01-13T10:30:42Z,https://i.ytimg.com/vi/CpDhKrekvIY/hqdefault.jpg,36031,CpDhKrekvIY,정보 공유의 혁명을 일으키고자 합니다.
11,2023-01-10T09:07:25Z,https://i.ytimg.com/vi/5twZPldn4CU/hqdefault.jpg,41386,5twZPldn4CU,소우주
12,2023-01-08T09:00:28Z,https://i.ytimg.com/vi/_GZ42XHg6ok/hqdefault.jpg,210565,_GZ42XHg6ok,"일본 독보적인 성과, 척추 재생 성공"
13,2023-01-02T09:00:12Z,https://i.ytimg.com/vi/Sf6Y1SAeqQc/hqdefault.jpg,689816,Sf6Y1SAeqQc,화성에 영원히 녹지 않는 눈이 내렸다. NASA와 유럽우주국이 실제 촬영한 기이한 현상들
14,2022-12-28T09:00:08Z,https://i.ytimg.com/vi/9JRElk-lZv0/hqdefault.jpg,136769,9JRElk-lZv0,애플 유저들은 꼭 보세요! 애플이 곧 없애버릴 '이것'... 예상도 못했을걸요?
15,2022-12-19T09:00:16Z,https://i.ytimg.com/vi/demaWcmUP1o/hqdefault.jpg,266783,demaWcmUP1o,"""뭔가와 닮아있다"".. 305,856코어 슈퍼컴퓨터가 만든 138억년 전 영상"
16,2022-12-13T09:00:23Z,https://i.ytimg.com/vi/jmeePtpS0hw/hqdefault.jpg,573330,jmeePtpS0hw,"[미국 정부 중대 발표] 인류 문명이 바뀔 발견, 핵융합 순에너지 생산 성공"
17,2022-12-09T09:00:34Z,https://i.ytimg.com/vi/wyGbP2plv6s/hqdefault.jpg,226714,wyGbP2plv6s,"""역사에 매국노로 기록될 것"".. 삼성 최악의 적은 내부에 있었다."
18,2022-12-05T09:00:16Z,https://i.ytimg.com/vi/jaYDNRkn1N0/hqdefault.jpg,561186,jaYDNRkn1N0,"사상 초유의 성과, 독일 실험실에서 초기 우주 생성 성공"
19,2022-11-30T09:00:12Z,https://i.ytimg.com/vi/OcCQrLOL6Tc/hqdefault.jpg,321053,OcCQrLOL6Tc,"정부 ""2025년부터 몰락 시작"".. 대한민국 이공계 소멸 위기"
20,2022-11-28T09:00:18Z,https://i.ytimg.com/vi/_qgAbZ75_Pw/hqdefault.jpg,98552,_qgAbZ75_Pw,"황희찬 골든골! 한국 16강 진출, 인공지능도 예측하지 못한 대이변"
21,2022-11-25T09:00:26Z,https://i.ytimg.com/vi/iSLLQUBbVxA/hqdefault.jpg,49922,iSLLQUBbVxA,왜 배터리는 충전하면 할수록 수명이 줄어들까
22,2022-11-21T09:00:18Z,https://i.ytimg.com/vi/NYXVbQo_kWY/hqdefault.jpg,144822,NYXVbQo_kWY,죽을 때 무엇을 경험할까? 최근 미 의학계가 밝혀낸 '죽음'에 대한 충격적인 사실들
23,2022-11-17T09:00:12Z,https://i.ytimg.com/vi/E5fAeaSdZ2c/hqdefault.jpg,259149,E5fAeaSdZ2c,인공지능보다 더 독한 놈이 나왔다. 게임하는 인공 뇌세포 개발 성공
24,2022-11-14T09:00:11Z,https://i.ytimg.com/vi/KOP3ChxeU5U/hqdefault.jpg,86287,KOP3ChxeU5U,"40억년 전 태초의 생명체를 만들어낸 단서 발견, 학계를 뒤흔든 의외의 물질"
25,2022-11-10T09:00:36Z,https://i.ytimg.com/vi/v_qBXaY9b70/hqdefault.jpg,150895,v_qBXaY9b70,삼성이 손 떼자마자 급등한 갤럭시 성능...이번엔 믿어도 될까?
26,2022-11-06T03:00:19Z,https://i.ytimg.com/vi/iy1qUZrzyAk/hqdefault.jpg,566998,iy1qUZrzyAk,"NASA ""화성 생명체 흔적 발견""... 그런데 전부 어디로 사라진 걸까?"
27,2022-11-03T09:00:36Z,https://i.ytimg.com/vi/tDVhGYDyOhU/hqdefault.jpg,130365,tDVhGYDyOhU,한국의 스타트업들 (with 프라이머 권도균)
28,2022-10-30T03:00:30Z,https://i.ytimg.com/vi/jx-ge8kXT9k/hqdefault.jpg,753394,jx-ge8kXT9k,"삼성도, SK도 아니다. 세계를 뒤흔든 한국판 다크호스의 등장 (나노기술)"
29,2022-10-28T09:00:00Z,https://i.ytimg.com/vi/09FzokxTJkk/hqdefault.jpg,154928,09FzokxTJkk,어떻게 애플은 단 몇 년 만에 모든 반도체 기업을 이겨버렸을까? (CEO 인터뷰)
30,2022-10-25T09:00:07Z,https://i.ytimg.com/vi/9qk2P1ZN71s/hqdefault.jpg,154559,9qk2P1ZN71s,"매우 심각한 대한민국 현 상황, 실험실과 대기업 그 어디에도 국산이 없다."
31,2022-10-19T09:00:07Z,https://i.ytimg.com/vi/CRpzM15WT9w/hqdefault.jpg,156409,CRpzM15WT9w,“곧 핵전쟁급 재앙 온다”…  AI과학자 3명 중 1명의 충격적인 예언
32,2022-10-16T09:00:24Z,https://i.ytimg.com/vi/uASIngbPKiY/hqdefault.jpg,75172,uASIngbPKiY,"영상 한 편에 최소 20,000GB인 시대가 온다."
33,2022-10-12T09:00:12Z,https://i.ytimg.com/vi/Npr5jD_iWbo/hqdefault.jpg,448134,Npr5jD_iWbo,"""세계 최초 기록""... 국내 연구팀 1억도 인공태양 안정화 방법 세계 최초 발견"
34,2022-10-09T09:00:13Z,https://i.ytimg.com/vi/QEo1FuYHbmQ/hqdefault.jpg,72181,QEo1FuYHbmQ,고도로 발달한 인공지능은 예수나 부처가 될 수 있을까?
35,2022-10-05T09:00:14Z,https://i.ytimg.com/vi/_bRc56u0Ub4/hqdefault.jpg,84859,_bRc56u0Ub4,현재 반도체 업계를 뒤흔들고 있는 초저전력 전쟁... 못 만들면 망한다.
36,2022-10-02T09:00:22Z,https://i.ytimg.com/vi/pYf4_XlmTGk/hqdefault.jpg,392660,pYf4_XlmTGk,"인간 뇌처럼 학습하는 물질 우연히 발견, 충격에 빠진 과학자들"
37,2022-09-28T09:00:01Z,https://i.ytimg.com/vi/a0DKAlRMLLg/hqdefault.jpg,117410,a0DKAlRMLLg,앞으로 미국과 중국에서 이걸 아이폰만큼 많이 보게 될겁니다.
38,2022-09-25T11:00:03Z,https://i.ytimg.com/vi/2V4SATUgy_0/hqdefault.jpg,67583,2V4SATUgy_0,"""신은 우주를 창조할 시간이 없었다"" 과학자들이 신을 믿지 않는 이유"
39,2022-09-21T09:00:29Z,https://i.ytimg.com/vi/vtrtEI02ApI/hqdefault.jpg,465057,vtrtEI02ApI,"아재폰이라 무시받던 갤럭시의 반전, 삼성 내부에선 이런 기술을 연구하고 있었다."
40,2022-09-15T09:00:16Z,https://i.ytimg.com/vi/fB7F4cFzp-4/hqdefault.jpg,118675,fB7F4cFzp-4,"""젖지 않아 기분이 이상해요"".. 너무 리얼해서 현업자들이 1등으로 꼽았다."
41,2022-09-13T09:00:05Z,https://i.ytimg.com/vi/9A_qIk4hy6g/hqdefault.jpg,253109,9A_qIk4hy6g,"""지금 지구가 뭔가 이상하다"" 전세계 과학자 1200명이 반란을 일으킨 이유 (지구온난화)"
42,2022-09-08T09:00:26Z,https://i.ytimg.com/vi/Qasr9GETnKM/hqdefault.jpg,50447,Qasr9GETnKM,전국 수돗물에 잠재적 발암물질 발견.. 수돗물 마셔도 될까?
43,2022-09-04T09:00:03Z,https://i.ytimg.com/vi/5iPpMTWfZLQ/hqdefault.jpg,248432,5iPpMTWfZLQ,대체 왜 폴더블 주름은 없어지지 않을까? (삼성 출신 폴더블 연구원)
44,2022-09-01T11:00:05Z,https://i.ytimg.com/vi/9cKtBADUdD4/hqdefault.jpg,86646,9cKtBADUdD4,왜 인간은 이 사진을 볼 수 없도록 진화했을까?
45,2022-08-29T10:00:05Z,https://i.ytimg.com/vi/9UaoLdf5EgM/hqdefault.jpg,68020,9UaoLdf5EgM,붙이면 몸 속을 보여주는 미친 스티커
46,2022-08-25T09:00:12Z,https://i.ytimg.com/vi/VtJmJqcUsoY/hqdefault.jpg,254173,VtJmJqcUsoY,이것들이 자연적으로 형성됐을리가 없다. 과학자들이 신을 믿는 이유
47,2022-08-22T11:00:09Z,https://i.ytimg.com/vi/HvBRg3RzoDM/hqdefault.jpg,110086,HvBRg3RzoDM,SK하이닉스의 한방
48,2022-08-19T11:00:31Z,https://i.ytimg.com/vi/YYaGQ9VimTc/hqdefault.jpg,78133,YYaGQ9VimTc,실체란 대체 무엇인가
49,2022-08-18T09:00:07Z,https://i.ytimg.com/vi/8XUM98I9mxA/hqdefault.jpg,25057,8XUM98I9mxA,국내 최고 대학 연구실 둘러보기 (서울대 대학원 #2)
50,2022-08-14T03:00:32Z,https://i.ytimg.com/vi/vbFXMUKusxk/hqdefault.jpg,117079,vbFXMUKusxk,서울대로 오는 지방대생들 (서울대 대학원 #1)
51,2022-08-12T09:00:21Z,https://i.ytimg.com/vi/brc_0c8xo64/hqdefault.jpg,157665,brc_0c8xo64,"100년 전 아인슈타인의 예측.. ""영원히"" 유지되는 레이저"
52,2022-08-11T09:00:33Z,https://i.ytimg.com/vi/ri69boYNDXc/hqdefault.jpg,97945,ri69boYNDXc,"전기차 시장을 지배한 현기차 붐, 현기차의 찐 경쟁력"
53,2022-08-03T09:00:15Z,https://i.ytimg.com/vi/ZMa-6a36yLQ/hqdefault.jpg,160389,ZMa-6a36yLQ,다누리 성공! 한국에서 세계가 주목 중인 결과가 나오다. (미국의 200배 성능)
54,2022-07-31T09:00:07Z,https://i.ytimg.com/vi/BLqXqXlYUI4/hqdefault.jpg,195089,BLqXqXlYUI4,"""중국 코인업체 말곤 고객이 없다"".. 예상보다 훨씬 심각한 삼성의 현 상황 (3나노 GAA)"
55,2022-07-28T09:00:03Z,https://i.ytimg.com/vi/8ELWN0MO0Po/hqdefault.jpg,213202,8ELWN0MO0Po,역사상 가장 섬뜩한 AI 상용화됐다... 리벤지포르노와 딥페이크 막을 수 없을지도 모른다.
56,2022-07-24T09:00:33Z,https://i.ytimg.com/vi/odQM8Gf3smg/hqdefault.jpg,125025,odQM8Gf3smg,일본이 침몰하고 있다. 과학계가 내놓은 일본의 암울한 전망
57,2022-07-21T09:00:08Z,https://i.ytimg.com/vi/L6Au-XSd97o/hqdefault.jpg,159533,L6Au-XSd97o,진짜 역대급입니다... 사람처럼 느끼고 교감하는 피부 개발 성공
58,2022-07-17T09:00:30Z,https://i.ytimg.com/vi/h8LRHoQJ4m0/hqdefault.jpg,241619,h8LRHoQJ4m0,과학자들은 충격을 금치 못했습니다. 암이 인간을 공격하는 시간이 있었습니다.
59,2022-07-15T11:00:23Z,https://i.ytimg.com/vi/iJzYTWh3vG4/hqdefault.jpg,67728,iJzYTWh3vG4,결국 1위는 또 애플... 전공자가 말하는 메타버스 시장의 미래 (with 카이스트)
60,2022-07-13T09:00:05Z,https://i.ytimg.com/vi/5v8jNMUuFnc/hqdefault.jpg,149772,5v8jNMUuFnc,물리학자들이 제시하는 가장 과학적인 우주 종말 시나리오
61,2022-07-10T09:00:33Z,https://i.ytimg.com/vi/u_S2fWh8pgU/hqdefault.jpg,168161,u_S2fWh8pgU,구글 미친놈들... 막으려는 임원들이 해고당한 논란의 인공지능 PaLM
62,2022-07-07T10:00:54Z,https://i.ytimg.com/vi/W2RNRd28qWs/hqdefault.jpg,289837,W2RNRd28qWs,교과서가 바뀌어야 될지도. 현재 이론으론 설명 불가능한 초초초거대 세균 발견!
63,2022-07-03T09:00:22Z,https://i.ytimg.com/vi/wTKThQdUSJ4/hqdefault.jpg,179549,wTKThQdUSJ4,"다중우주가 존재한다는 결정적인 증거 (아인슈타인, 슈뢰딩거의 주장)"
64,2022-06-30T09:00:01Z,https://i.ytimg.com/vi/1jZeCCG4b00/hqdefault.jpg,117284,1jZeCCG4b00,"OECD·UN·과학자들의 잇따른 경고, 올 가을 한국에 역대급 식량위기 온다."
65,2022-06-26T03:00:00Z,https://i.ytimg.com/vi/1k2FAWiO7yU/hqdefault.jpg,565977,1k2FAWiO7yU,"""삼성 직원들도 아이폰 써""... 현업 연구원들도 인정한 아이폰 미친 성능의 비밀"
66,2022-06-23T09:00:21Z,https://i.ytimg.com/vi/oKKP75p8Kew/hqdefault.jpg,80132,oKKP75p8Kew,아르테미스 미션
67,2022-06-20T09:00:21Z,https://i.ytimg.com/vi/nim4Y89CAQU/hqdefault.jpg,366527,nim4Y89CAQU,테슬라 이건 진짜 미쳤습니다. 충전 시 100년 가는 배터리 개발 성공...ㄷㄷ
68,2022-06-17T11:00:14Z,https://i.ytimg.com/vi/QzSE7Gp3ON0/hqdefault.jpg,131921,QzSE7Gp3ON0,"현시간 세계에서 난리난 연구, 2억 명을 죽인 전염병의 충격적인 근원지"
69,2022-06-16T09:00:19Z,https://i.ytimg.com/vi/kGOIrTzdJgI/hqdefault.jpg,61674,kGOIrTzdJgI,꿈 꾸면 피곤한데 대체 왜 꿈을 꾸는 것일까? (최신 연구 결과)
70,2022-06-14T09:00:09Z,https://i.ytimg.com/vi/OzoiHHCfYNg/hqdefault.jpg,289025,OzoiHHCfYNg,스크린을 핥으면 맛이 느껴지는 세상이 온다...!
71,2022-06-12T03:00:05Z,https://i.ytimg.com/vi/Dvl5GSOfc_g/hqdefault.jpg,173024,Dvl5GSOfc_g,양자컴퓨터는 정말로 인류를 종말로 이끌까? 양자컴퓨터의 모든 것!
72,2022-06-09T09:00:09Z,https://i.ytimg.com/vi/OJhEUTIrqaQ/hqdefault.jpg,91893,OJhEUTIrqaQ,"""최소 50조원 가치""... 만삭의 여교수가 개발한  충전이 필요없는 배터리"
73,2022-06-06T03:00:13Z,https://i.ytimg.com/vi/kGfIfIdreDE/hqdefault.jpg,131994,kGfIfIdreDE,경고 : 국뽕 채널 좋아하는 사람들은 상처받을 겁니다.
74,2022-06-05T09:00:08Z,https://i.ytimg.com/vi/8i66WuWkTB8/hqdefault.jpg,158849,8i66WuWkTB8,"""중력 30,000배"" 괴물의 탄생. 눈으로 보고도 믿기 어려운 미국의 극초음속 괴물"
75,2022-06-02T09:00:19Z,https://i.ytimg.com/vi/juby4qD7D2k/hqdefault.jpg,115019,juby4qD7D2k,탈원전이 불러온 후폭풍
76,2022-05-30T09:00:15Z,https://i.ytimg.com/vi/J7_JZMv2GGQ/hqdefault.jpg,106185,J7_JZMv2GGQ,제임스웹을 압도한다. NASA 기술력이 이미 수십 년은 앞서 있는 이유
77,2022-05-26T09:00:12Z,https://i.ytimg.com/vi/RE5AmUS_ehY/hqdefault.jpg,192457,RE5AmUS_ehY,미국 '좋소기업'의 위엄... 애플과 엔비디아조차 무릎 꿇은 정신나간 성능
78,2022-05-23T09:00:17Z,https://i.ytimg.com/vi/Mv0mRcZi9uU/hqdefault.jpg,126639,Mv0mRcZi9uU,외계인들이나 미래인들조차 풀어낼 수 없는 것 (과거는 닫혀있다)
79,2022-05-19T09:00:04Z,https://i.ytimg.com/vi/9wEeih5f3e4/hqdefault.jpg,322850,9wEeih5f3e4,"""줄퇴사 이어진다"" 심각한 내부 분위기, 삼성 반도체 몰락의 진짜 원인"
80,2022-05-12T09:00:20Z,https://i.ytimg.com/vi/uyi_4q8sA60/hqdefault.jpg,173435,uyi_4q8sA60,가상화폐에 부정적인 사람들에게 전하는 블록체인의 미래 (ft 루나 대폭락)
81,2022-05-09T09:00:08Z,https://i.ytimg.com/vi/ChwHnzWEw4I/hqdefault.jpg,132588,ChwHnzWEw4I,"""전기차 완충 3분 컷""... 한국이 제시한 '충전속도 200배' 역대급 배터리"
82,2022-05-07T04:00:25Z,https://i.ytimg.com/vi/fkVIXUwiqm8/hqdefault.jpg,194864,fkVIXUwiqm8,NASA가 공개한 블랙홀의 소름끼치게 무서운 실제 소리
83,2022-05-06T09:00:35Z,https://i.ytimg.com/vi/p7Ki9CvEiok/hqdefault.jpg,86009,p7Ki9CvEiok,5000년 전 고대 영국인들의 미친 과학기술력 (스톤헨지)
84,2022-05-04T09:00:33Z,https://i.ytimg.com/vi/rEDeBPA9HXc/hqdefault.jpg,97277,rEDeBPA9HXc,MIT가 만든 노래 부르는 종이
85,2022-05-02T09:00:00Z,https://i.ytimg.com/vi/-fFMpMCHTnY/hqdefault.jpg,56704,-fFMpMCHTnY,종이컵에서 나노플라스틱 수조개 검출됐다.
86,2022-04-28T09:00:31Z,https://i.ytimg.com/vi/irllXjv8_d4/hqdefault.jpg,142225,irllXjv8_d4,역사는 일론 머스크를 신으로 기록할 것이다. 8년 넘게 개발 중인 불로장생 기술
87,2022-04-25T09:00:00Z,https://i.ytimg.com/vi/15JcuT9o-z8/hqdefault.jpg,75861,15JcuT9o-z8,삼성이 AP는 못 만들어도 이건 잘 만들어요.
88,2022-04-22T09:00:06Z,https://i.ytimg.com/vi/EQLtryZw9fI/hqdefault.jpg,216411,EQLtryZw9fI,"어이가 없는 애플의 계획, 10년 내에 아이폰 없앤다."
89,2022-04-21T09:00:23Z,https://i.ytimg.com/vi/uPyEpwHTUrA/hqdefault.jpg,82012,uPyEpwHTUrA,"인천 과고 출신 한국인 물리학자, 노벨물리학자와 궁극의 화학반응 구현"
90,2022-04-18T10:00:37Z,https://i.ytimg.com/vi/yqNApxpyc5k/hqdefault.jpg,166779,yqNApxpyc5k,중국이 또 일냈다. 정자 없이 난자 만으로 임신 성공 ㄷㄷㄷㄷ
91,2022-04-14T09:00:33Z,https://i.ytimg.com/vi/vKwoH4_Lo1g/hqdefault.jpg,194548,vKwoH4_Lo1g,국뽕 채널들은 죽어도 말 안한다. 한국의 기술 우위 진작 끝났다.
92,2022-04-11T11:00:00Z,https://i.ytimg.com/vi/a0DnKEH7npA/hqdefault.jpg,110099,a0DnKEH7npA,우주는 양자컴퓨터다.
93,2022-04-07T10:00:14Z,https://i.ytimg.com/vi/WSjrNvo5Icc/hqdefault.jpg,111165,WSjrNvo5Icc,알 수 없는 유튜브 알고리즘의 원리
94,2022-04-05T09:00:10Z,https://i.ytimg.com/vi/EPQutbbCFn0/hqdefault.jpg,1413676,EPQutbbCFn0,[NASA오피셜] 화성에서 가장 위험한 공포의 7분... 실제 촬영된 영상과 소리
95,2022-04-04T09:00:30Z,https://i.ytimg.com/vi/lf8LsM-fVZo/hqdefault.jpg,110366,lf8LsM-fVZo,시간이 얼어 붙은 장면
96,2022-03-31T09:00:26Z,https://i.ytimg.com/vi/yS-8h3qp-Cc/hqdefault.jpg,156044,yS-8h3qp-Cc,🇺🇸🛸🛸🛸🛸🛸🛸🛸
97,2022-03-27T12:00:11Z,https://i.ytimg.com/vi/PW25yUv8ao4/hqdefault.jpg,131484,PW25yUv8ao4,MIT 천재들이 만든 연 200만명을 살리는 신기술 (ft 친원전 대한민국)
98,2022-03-23T09:00:23Z,https://i.ytimg.com/vi/Z-llzmD45Ns/hqdefault.jpg,225139,Z-llzmD45Ns,"GOS로 불거진 삼성 창사 이래 최대 위기, 반도체 기술 우위 끝났다."
99,2022-03-17T10:00:04Z,https://i.ytimg.com/vi/9hyJ8yCxHFk/hqdefault.jpg,389137,9hyJ8yCxHFk,"종교계가 반대하는 이유, 10년 안에 신은 사라진다. (노벨상 받은 금단의 기술)"
100,2022-03-14T09:06:31Z,https://i.ytimg.com/vi/9laqhsZxM1M/hqdefault.jpg,345781,9laqhsZxM1M,"아직도 사람들은 못 믿는다. 삼성, 인텔, AMD 모두 찢어버리는 반도체 생태계 파괴자 (ft 메타버스)"
101,2022-03-13T05:00:04Z,https://i.ytimg.com/vi/Ct6Em-EePSY/hqdefault.jpg,54679,Ct6Em-EePSY,NASA도 풀 수 없었던 초록색 혜성의 정체
102,2022-03-12T08:00:04Z,https://i.ytimg.com/vi/Cmr4dn7Dyiw/hqdefault.jpg,212643,Cmr4dn7Dyiw,그림을 실체로 만드는 기술 #shorts
103,2022-03-09T05:00:10Z,https://i.ytimg.com/vi/Bz8G-b5_WRg/hqdefault.jpg,503372,Bz8G-b5_WRg,"""죽을때 뭘 느낄까?""  해외에서 난리난 연구... 인간이 죽을때 겪는 소름돋는 현상"
104,2022-03-06T09:00:16Z,https://i.ytimg.com/vi/_Civq0KdH5Y/hqdefault.jpg,125673,_Civq0KdH5Y,"국내 연구진, 세계 최초 디스플레이 인쇄 성공"
105,2022-03-03T12:00:20Z,https://i.ytimg.com/vi/r2PGp29MGCM/hqdefault.jpg,228362,r2PGp29MGCM,양자역학을 시각화한 경이로운 영상
106,2022-03-02T09:00:31Z,https://i.ytimg.com/vi/j3IoxiobjWw/hqdefault.jpg,183295,j3IoxiobjWw,단 0.8% 사람만 가진 세상에서 가장 위험한 MBTI
107,2022-02-27T03:00:05Z,https://i.ytimg.com/vi/Kpo6eCu2xLk/hqdefault.jpg,121668,Kpo6eCu2xLk,배터리도 연료도 필요없는 신소재 탄생!
108,2022-02-25T11:00:30Z,https://i.ytimg.com/vi/SwVWXTEZrBY/hqdefault.jpg,78321,SwVWXTEZrBY,미래 예측 방정식 (라플라스의 악마)
109,2022-02-23T09:00:33Z,https://i.ytimg.com/vi/oBUwQhXy8Y8/hqdefault.jpg,169350,oBUwQhXy8Y8,"태양의 숨겨진 빈공간, 23년 만에 그 비밀이 밝혀지다."
110,2022-02-20T06:30:04Z,https://i.ytimg.com/vi/7zHdG5nwa5k/hqdefault.jpg,95343,7zHdG5nwa5k,기존에 없던 새로운 생명체의 탄생
111,2022-02-19T11:00:32Z,https://i.ytimg.com/vi/lT1sFPvWJpU/hqdefault.jpg,3225226,lT1sFPvWJpU,중국에서 만든 생각을 읽는 옷  #shorts
112,2022-02-17T10:00:36Z,https://i.ytimg.com/vi/vhOBBPJZ3yU/hqdefault.jpg,131988,vhOBBPJZ3yU,인류 대종말의 징후 포착됐다.
113,2022-02-13T11:00:02Z,https://i.ytimg.com/vi/6H7sEAb0I_I/hqdefault.jpg,130050,6H7sEAb0I_I,"신의 경이로움을 보여주는 사진, 은하의 심장"
114,2022-02-10T10:00:08Z,https://i.ytimg.com/vi/G73r3KuqOAE/hqdefault.jpg,434480,G73r3KuqOAE,"""사상 최초 한국인 선정"" 이 연구로 인류는 수십 년의 시간을 앞서게 됐습니다. (로제타폴드)"
115,2022-02-07T11:00:18Z,https://i.ytimg.com/vi/lW8kaE_t3DI/hqdefault.jpg,179731,lW8kaE_t3DI,"""갤럭시S30 = 1년에 1번 충전""  IBS, 삼성전자 박사들이 10년 넘게 연구한 역대급 신기술"
116,2022-02-05T09:00:32Z,https://i.ytimg.com/vi/gvoDlNVGiQw/hqdefault.jpg,282585,gvoDlNVGiQw,세상에서 가장 복잡한 이론 #shorts
117,2022-02-03T09:00:27Z,https://i.ytimg.com/vi/zBYGlX_sINs/hqdefault.jpg,155521,zBYGlX_sINs,"미국, 압도적인 성능의 신소재 개발 성공"
118,2022-01-30T09:00:24Z,https://i.ytimg.com/vi/Olbn8puh-Hk/hqdefault.jpg,152392,Olbn8puh-Hk,지구에서 바라본 우주의 진짜 모습 (100억 광년 거리까지)
119,2022-01-29T12:00:02Z,https://i.ytimg.com/vi/4SOKm8dnDtY/hqdefault.jpg,453539,4SOKm8dnDtY,단 한번이라도 원자들의 실제 모습을 본 적 있나요? #shorts
120,2022-01-27T10:00:16Z,https://i.ytimg.com/vi/lL10gJA5XPw/hqdefault.jpg,90874,lL10gJA5XPw,맨손을 펄펄 끓는 쇳물에 넣어도 멀쩡한 이유
121,2022-01-24T11:00:05Z,https://i.ytimg.com/vi/GBYkmiMlatE/hqdefault.jpg,332613,GBYkmiMlatE,테슬라가 세상을 지배한다. 전문가들만 아는 테슬라의 끝판왕 기술
122,2022-01-23T10:00:26Z,https://i.ytimg.com/vi/ZPJ5aNbnRGk/hqdefault.jpg,1952348,ZPJ5aNbnRGk,화성에서 초거대 폭풍이 몰아치는 장면이 촬영되다. #shorts
123,2022-01-20T11:00:33Z,https://i.ytimg.com/vi/ocpoovyQFxg/hqdefault.jpg,200309,ocpoovyQFxg,구글이 우주의 법칙을 거스르는 물질을 구현하는데 성공하다. (배터리 없이 영원히 흐르는 시계)
124,2022-01-17T11:00:24Z,https://i.ytimg.com/vi/zybtZnjkLh0/hqdefault.jpg,76824,zybtZnjkLh0,"태평양 뒤덮는데 3년, 사람들은 모르는 일본 오염수의 영향"
125,2022-01-14T10:00:32Z,https://i.ytimg.com/vi/fIz3DGNx2e0/hqdefault.jpg,287859,fIz3DGNx2e0,빛의 시간을 돌려버린 영상 #shorts
126,2022-01-13T10:00:07Z,https://i.ytimg.com/vi/C0ARbLvQJFY/hqdefault.jpg,114419,C0ARbLvQJFY,은하 중앙에서 실제 외계 신호 포착
127,2022-01-10T11:00:30Z,https://i.ytimg.com/vi/c6YkaKj9LfQ/hqdefault.jpg,339384,c6YkaKj9LfQ,"2022년 우리나라에서 역대급 연구 성과가 나옵니다. (암, 코로나 모두 치료할 신기술)"
128,2022-01-06T10:00:12Z,https://i.ytimg.com/vi/bXLFGjXRw2E/hqdefault.jpg,128724,bXLFGjXRw2E,"""살상률 100%"" 가짜피로 유인해 독살시켜 죽여버리는 역대급 모기트랩"
129,2022-01-05T09:00:25Z,https://i.ytimg.com/vi/pvjkskMBz6M/hqdefault.jpg,2435094,pvjkskMBz6M,수영장조차 하늘에 거꾸로 띄어버리는 과학적인 방법 #shorts
130,2022-01-03T12:00:24Z,https://i.ytimg.com/vi/z7VXdU1Omeg/hqdefault.jpg,203792,z7VXdU1Omeg,"구글의 최신 인공지능, 수학 교수들도 못 푸는 수학 문제를 풀어버리다."
131,2021-12-30T10:00:07Z,https://i.ytimg.com/vi/LzCR5b52WJA/hqdefault.jpg,142825,LzCR5b52WJA,아인슈타인이 예견한 우주에서 가장 공포스러운 현상 (우주쓰나미)
132,2021-12-29T12:00:20Z,https://i.ytimg.com/vi/eF5CiSwnNJE/hqdefault.jpg,6309228,eF5CiSwnNJE,앞으로 미국에서 전쟁나면 이걸 수백 만개는 보게 될겁니다. #shorts
133,2021-12-27T11:00:14Z,https://i.ytimg.com/vi/UQcbZAJuLRo/hqdefault.jpg,456830,UQcbZAJuLRo,[NASA오피셜] 목성 근처에 가면 들리는 소름끼치는 소리
134,2021-12-24T09:00:30Z,https://i.ytimg.com/vi/Q578lWxemjY/hqdefault.jpg,161370,Q578lWxemjY,논문에서 말하는 연애 못하는 솔로들의 소름 돋는 특징...ㄷㄷ
135,2021-12-22T11:00:21Z,https://i.ytimg.com/vi/hTQSVU9w7YI/hqdefault.jpg,39541,hTQSVU9w7YI,미세먼지 측정하는 방법 (with 환경부)
136,2021-12-20T09:00:14Z,https://i.ytimg.com/vi/_ExdH5pFIUE/hqdefault.jpg,2949993,_ExdH5pFIUE,녹지 않는 얼음 #shorts
137,2021-12-19T12:00:17Z,https://i.ytimg.com/vi/lq-AHF55Mow/hqdefault.jpg,354382,lq-AHF55Mow,여러분은 절대로 어디서 촬영되고 있는지 알 수 없을 겁니다. 소름돋는 발전 속도... (미국이 최초로 성공시키다)
138,2021-12-16T10:00:30Z,https://i.ytimg.com/vi/hK9X1o59hrA/hqdefault.jpg,105006,hK9X1o59hrA,MIT와 NASA도 아직까지 납득하지 못했다. 외계 태양 근처에서 발견된 기이한 현상
139,2021-12-12T12:00:11Z,https://i.ytimg.com/vi/Qy4ZExowuF4/hqdefault.jpg,176868,Qy4ZExowuF4,"[보고 욕하세요] NASA ""미세먼지는 중국보다 한국 영향이 더 크다"" 대체 왜???"
140,2021-12-10T12:00:13Z,https://i.ytimg.com/vi/UuYHosv-YiA/hqdefault.jpg,1944435,UuYHosv-YiA,말랑한데 누르면 강철처럼 강화되는 기이한 소재 #shorts
141,2021-12-08T09:00:17Z,https://i.ytimg.com/vi/fC01CwbwDHU/hqdefault.jpg,418968,fC01CwbwDHU,"""750000000000000000000000000000000000000000000000000000000000000000 TB"" 우주의 무서움을 느껴보세요."
142,2021-12-06T11:00:11Z,https://i.ytimg.com/vi/Rn-0EybSk2Q/hqdefault.jpg,80076,Rn-0EybSk2Q,전국민의 피를 말린 21세기 가장 치열했던 한·일 기술전쟁 (수출규제 2년)
143,2021-12-05T09:00:24Z,https://i.ytimg.com/vi/pQ54ly4aLTc/hqdefault.jpg,128697,pQ54ly4aLTc,※심약자 주의※ 죽은 암컷과 교미하고 좀비가 됩니다. 현실판 좀비 바이러스의 공포
144,2021-12-02T10:00:17Z,https://i.ytimg.com/vi/njDJTjfwB7I/hqdefault.jpg,152761,njDJTjfwB7I,과학•철학이 지옥🔥의 존재를 반박하다. 사후세계는 없다! (예일대 철학자의 주장)
145,2021-11-30T09:00:05Z,https://i.ytimg.com/vi/Dm9TqcLU8GQ/hqdefault.jpg,148277,Dm9TqcLU8GQ,장담컨대 이게 우리나라 미래의 대표산업이 됩니다. (미·중·일 대기업들도 쩔쩔매는 기술)
146,2021-11-27T09:00:33Z,https://i.ytimg.com/vi/k-sR82KX1eI/hqdefault.jpg,102088,k-sR82KX1eI,"현대과학의 미친 발전, 이게 앞으로의 의학계를 지배한다. (오미크론 변이 치료 가속화)"
147,2021-11-26T11:00:35Z,https://i.ytimg.com/vi/qWaxYEOnxPM/hqdefault.jpg,142025,qWaxYEOnxPM,모두가 안된다 했지만 이제 XX도 가능합니다. 장담하는데 절대 구분 못합니다. (인공인간)
