,Published,HDThumbnailUrl,ViewCount,VideoId,Title
404,2019-06-09T08:00:04Z,https://i.ytimg.com/vi/hsj5g5B5enM/hqdefault.jpg,225791,hsj5g5B5enM,"순간이동이 실제로 가능할까? 30년전, 순간이동의 단서가 발견되다! (현대과학이 말하는 미래기술)"
405,2019-06-05T08:00:00Z,https://i.ytimg.com/vi/5sA4HGvbSOo/hqdefault.jpg,213323,5sA4HGvbSOo,남자의 인기를 결정하는 가장 큰 요소는 무엇일까? SCI 전문 과학논문으로 알아보다.
406,2019-05-23T09:00:07Z,https://i.ytimg.com/vi/uMCq4xyl-1s/hqdefault.jpg,160487,uMCq4xyl-1s,남들이 뭐라건 알바야? 천재들의 천재 파인만과 아인슈타인의 소름돋는 자신감!
407,2019-05-19T08:00:00Z,https://i.ytimg.com/vi/6J3-5pTbBNQ/hqdefault.jpg,408579,6J3-5pTbBNQ,해리포터처럼 벽을 뚫고 지나갈 수 있을까? (현대과학이 말하는 초능력)
408,2019-05-12T09:00:09Z,https://i.ytimg.com/vi/X4KMNZ6BNTU/hqdefault.jpg,1196658,X4KMNZ6BNTU,과학이 신의 존재를 반박하다. 신은 없다! (스티븐 호킹/하이젠베르크/칼 세이건등 최고의 학자들의 주장)
409,2019-05-09T09:00:05Z,https://i.ytimg.com/vi/gzE0U0fCsfY/hqdefault.jpg,219057,gzE0U0fCsfY,"한 분야의 박사가 된다는 것, 상위 0.02%가 된다는 것 (박사들에게 물어본 대학원 이야기)"
410,2019-05-01T08:00:08Z,https://i.ytimg.com/vi/t44c6aVpXiw/hqdefault.jpg,256439,t44c6aVpXiw,시간은 흐르지 않는다. 시간은 얼어있다! 당신이 착각하고 있던 시간의 진실
411,2019-04-29T08:00:02Z,https://i.ytimg.com/vi/5Qk6R6qFB8E/hqdefault.jpg,56311,5Qk6R6qFB8E,삼성전자가 130조를 투자한 비메모리반도체의 미래와 차세대 기술 전자패키지
412,2019-04-24T07:58:54Z,https://i.ytimg.com/vi/H0n-YqTuLfE/hqdefault.jpg,184889,H0n-YqTuLfE,"어벤져스 캡틴의 방패, 실사판 비브라늄! 다이아몬드보다 40배 강한 미친 성능의 신소재 (인류가 발견한 가장 단단한 물질)"
413,2019-04-21T08:22:28Z,https://i.ytimg.com/vi/-w0ZtPJwb9M/hqdefault.jpg,425707,-w0ZtPJwb9M,우주 탄생의 비밀! 아인슈타인도 죽기 전까지 풀지 못한 역사상 최악의 난제는? (인터스텔라에도 나온 대통일이론)
414,2019-04-14T09:20:57Z,https://i.ytimg.com/vi/qHDlhsJtdAo/hqdefault.jpg,619964,qHDlhsJtdAo,스티븐 호킹이 말한 시간이 존재하지 않는 세상! 신이 존재하지 않는 이유. (블랙홀에 시계를 던졌을 때 일어나는 일)
415,2019-04-06T10:54:01Z,https://i.ytimg.com/vi/N4DBR8fq7_Q/hqdefault.jpg,2452681,N4DBR8fq7_Q,"""교수님이 틀렸다면 어떡할겁니까?"" 한 학생이 수업 중에 아인슈타인에게 질문을 던졌다. (feat 블랙홀 관측에 성공하다!) [ENG]"
416,2019-04-04T12:35:49Z,https://i.ytimg.com/vi/u5RqobX1618/hqdefault.jpg,37848,u5RqobX1618,"수치로 본 삼성의 위엄, 그리고 반도체의 미래.│ 갤럭시폴드, 갤럭시s10, DRAM, HBM의 약진"
417,2019-03-30T07:07:54Z,https://i.ytimg.com/vi/ePxFc8jC2wk/hqdefault.jpg,112170,ePxFc8jC2wk,높은 사람들의 아들딸이 명문대를 쉽게 가는 이유 (금수저의 특별 입시전형)
418,2019-03-25T11:26:49Z,https://i.ytimg.com/vi/xKNlHwkTctg/hqdefault.jpg,140447,xKNlHwkTctg,"현재의 삼성, 인텔, 애플을 만든 게 한국인이란 걸 알고 있나요? 노벨상이 가장 유력했던 과학자의 이야기!"
419,2019-03-15T12:10:36Z,https://i.ytimg.com/vi/T7YF7jmn4x0/hqdefault.jpg,374570,T7YF7jmn4x0,"한때 200만원이었던 발렌시아가 트리플S, 사면 안 되는 이유! | 구입 고민 중이신 분이 꼭 봐야할 영상"
420,2019-03-11T12:42:52Z,https://i.ytimg.com/vi/jdtOj6o8iaQ/hqdefault.jpg,342168,jdtOj6o8iaQ,데이터가 말하는 흙수저의 인생... 갈수록 심화되는 빈부격차
421,2019-02-01T00:43:48Z,https://i.ytimg.com/vi/TN7GcgQ_k_w/hqdefault_live.jpg,0,TN7GcgQ_k_w,에스오디STORY님의 실시간 스트리밍
422,2018-12-08T16:06:05Z,https://i.ytimg.com/vi/558LNnFxEsY/hqdefault.jpg,340088,558LNnFxEsY,"검증된 SCI 과학논문으로 분석한 ""진짜"" 키 크는방법 │ 한약, 우유, 운동, 성장호르몬 등이 키 크는데 정말로 도움을 주는가?"
